"X","journal","year","title","fname_first","lname_first","fname_last","lname_last","affiliation","article_type","middle_authors","abstract","fname_first_trunc","fname_last_trunc","gender_first","p_first","n_first","gender_last","p_last","n_last"
14852,"Nature reviews. Neuroscience",2010,"Do astrocytes really exocytose neurotransmitters?","Nicola B","Hamilton","David","Attwell","Department of Neuroscience, Physiology and Pharmacology, University College London, Gower Street, London, WC1E 6BT, UK.","Journal Article","[]","True","Nicola","David","female",0.71,1226,"male",1,12593
14853,"Nature reviews. Neuroscience",2010,"Modelling the molecular mechanisms of synaptic plasticity using systems biology approaches.","Jeanette Hellgren","Kotaleski","Kim T","Blackwell","Royal Institute of Technology, School of Computer Science and Communication, AlbaNova University Center, 106 91 Stockholm, Sweden. jeanette@nada.kth.se","Journal Article","[]","True","Jeanette","Kim","female",1,492,"female",0.88,3561
20403,"Nature reviews. Neuroscience",2012,"Synaptic plasticity: Ubiquitin activates synaptic plasticity.","Katherine","Whalley","","","","Comment","[]","False","Katherine","","female",1,1413,NA,NA,NA
20404,"Nature reviews. Neuroscience",2012,"Computational neuroanatomy of speech production.","Gregory","Hickok","","","Department of Cognitive Sciences, University of California, Irvine, California 92697, USA. gshickok@uci.edu","Research Support, N.I.H., Extramural","[]","True","Gregory","","male",1,721,NA,NA,NA
20408,"Nature reviews. Neuroscience",2012,"Mitochondrial transport in neurons: impact on synaptic homeostasis and neurodegeneration.","Zu-Hang","Sheng","Qian","Cai","Synaptic Function Section, The Porter Neuroscience Research Center, National Institute of Neurological Disorders and Stroke, National Institutes of Health, Room 2B-215, 35 Convent Drive, Bethesda, Maryland 20892-3706, USA. shengz@ninds.nih.gov","Journal Article","[]","True","Zu-Hang","Qian",NA,NA,NA,"female",0.75,8
20884,"Nature reviews. Neuroscience",2007,"Intracellular amyloid-beta in Alzheimer's disease.","Frank M","LaFerla","Salvatore","Oddo","Department of Neurobiology and Behaviour, and Institute for Brain Aging and Dementia, University of California, Irvine, California 92697-4545, USA. laferla@uci.edu","Journal Article","['Kim N']","True","Frank","Salvatore","male",1,1565,"male",1,409
14588,"Nature reviews. Neuroscience",2012,"Artificial activation of a memory trace.","Leonie","Welberg","","","","Comment","[]","False","Leonie","","female",1,118,NA,NA,NA
14589,"Nature reviews. Neuroscience",2012,"The economy of brain network organization.","Ed","Bullmore","Olaf","Sporns","Behavioural & Clinical Neuroscience Institute, University of Cambridge, Department of Psychiatry, Cambridge Biomedical Campus, Cambridge CB2 0SZ, UK. etb23@cam.ac.uk","Journal Article","[]","True","Ed","Olaf","male",1,824,"male",1,65
14592,"Nature reviews. Neuroscience",2012,"Axonal mRNA localization and local protein synthesis in nervous system assembly, maintenance and repair.","Hosung","Jung","Christine E","Holt","Department of Physiology, Development and Neuroscience, University of Cambridge, Downing Street, Cambridge                 CB2 3DY, UK.","Journal Article","['Byung C']","True","Hosung","Christine","male",1,1,"female",1,3115
24739,"Nature reviews. Neuroscience",2012,"Impaired mitochondrial function in psychiatric disorders.","Husseini","Manji","Guang","Chen","Janssen Research & Development, LLC, Raritan, New Jersey 08869, USA. hmanji@its.jnj.com","Journal Article","['Tadafumi', 'Nicholas A', 'Seth', 'M Flint', 'Michael']","True","Husseini","Guang",NA,NA,NA,"female",0.67,3
24740,"Nature reviews. Neuroscience",2012,"Neurodegenerative networking.","Darran","Yates","","","","Comment","[]","False","Darran","","male",1,13,NA,NA,NA
24742,"Nature reviews. Neuroscience",2012,"Sourcing local produce.","Leonie","Welberg","","","","Comment","[]","False","Leonie","","female",1,118,NA,NA,NA
2949,"Nature reviews. Neuroscience",2008,"Central mechanisms of osmosensation and systemic osmoregulation.","Charles W","Bourque","","","Centre for Research in Neuroscience, Research Institute of the McGill University Health Centre, Room L7-216, Montreal General Hospital, 1650 Cedar Avenue, Montreal, Quebec, H3G 1A4, Canada. charles.bourque@mcgill.ca","Journal Article","[]","True","Charles","","male",1,1798,NA,NA,NA
28637,"Nature reviews. Neuroscience",2009,"The origin and evolution of synapses.","Tomás J","Ryan","Seth G N","Grant","Wellcome Trust Sanger Institute, Hinxton, Cambridge CB101SA, UK.","Journal Article","[]","True","Tomás","Seth","male",0.97,36,"male",1,373
28639,"Nature reviews. Neuroscience",2009,"MicroRNAs tell an evo-devo story.","Kenneth S","Kosik","","","Neuroscience Research Institute and the Department of Molecular, Cellular, and Developmental Biology, University of California, Santa Barbara, California 93106, USA. kosik@lifesci.ucsb.edu","Review","[]","True","Kenneth","","male",1,1020,NA,NA,NA
28640,"Nature reviews. Neuroscience",2009,"Chordate roots of the vertebrate nervous system: expanding the molecular toolkit.","Linda Z","Holland","","","Marine Biology Research Division, Scripps Institution of Oceanography, University of California San Diego, La Jolla, California 92093-0202, USA. lzholland@ucsd.edu","Journal Article","[]","True","Linda","","female",1,4323,NA,NA,NA
7419,"Nature reviews. Neuroscience",2009,"Coding and use of tactile signals from the fingertips in object manipulation tasks.","Roland S","Johansson","J Randall","Flanagan","Physiology Section, Department of Integrative Medical Biology, Umeå University, SE-901 87 Umeå, Sweden. roland.s.johansson@physiol.umu.se","Journal Article","[]","True","Roland","Randall","male",1,255,"male",0.99,176
7425,"Nature reviews. Neuroscience",2009,"Parallel processing strategies of the primate visual system.","Jonathan J","Nassi","Edward M","Callaway","Harvard Medical School, Department of Neurobiology, 220 Longwood Avenue, Boston, Massachusetts 02115, USA.","Journal Article","[]","True","Jonathan","Edward","male",1,3702,"male",1,1015
29048,"Nature reviews. Neuroscience",2009,"Microtubule assembly, organization and dynamics in axons and dendrites.","Cecilia","Conde","Alfredo","Cáceres","Laboratorio de Neurobiología Celular y Molecular, Instituto Investigación Médica Mercedes y Martín Ferreyra (INIMEC-CONICET), Friuli 2434, 5016 Córdoba, Argentina.","Journal Article","[]","True","Cecilia","Alfredo","female",0.99,1101,"male",1,687
29049,"Nature reviews. Neuroscience",2009,"The probability of neurotransmitter release: variability and feedback control at single synapses.","Tiago","Branco","Kevin","Staras","Wolfson Institute for Biomedical Research and Department of Neuroscience, Physiology and Pharmacology, University College London, WC1E 6BT, UK. t.branco@ucl.ac.uk","Research Support, Non-U.S. Gov't","[]","True","Tiago","Kevin","male",1,231,"male",1,5362
29050,"Nature reviews. Neuroscience",2009,"Phasic acetylcholine release and the volume transmission hypothesis: time to move on.","Martin","Sarter","W Matthew","Howe","Department of Psychology and Neuroscience Program, University of Michigan, Ann Arbor, Michigan 48109-1043, USA. msarter@umich.edu","Research Support, N.I.H., Extramural","['Vinay']","True","Martin","Matthew","male",1,3568,"male",1,3338
29051,"Nature reviews. Neuroscience",2009,"Effects of prenatal opiate exposure on brain development--a call for attention.","Kristine B","Walhovd","Lars","Smith","","Comment","['Vibeke', 'Kari', 'Torill', 'Anders M', 'Astrid']","False","Kristine","Lars","female",1,527,"male",1,450
4307,"Nature reviews. Neuroscience",2012,"Emerging roles of non-coding RNAs in brain evolution, development, plasticity and disease.","Irfan A","Qureshi","Mark F","Mehler","Roslyn and Leslie Goldstein Laboratory for Stem Cell Biology and Regenerative Medicine, Albert Einstein College of Medicine, Bronx, New York, New York 10461, USA. irfan@jhu.edu","Journal Article","[]","True","Irfan","Mark","male",1,226,"male",1,6176
16375,"Nature reviews. Neuroscience",2012,"Psychotropic medications and mitochondrial toxicity.","Rebecca","Anglin","Michael","Mazurek","","Comment","['Patricia']","False","Rebecca","Michael","female",1,3182,"male",1,11094
8908,"Nature reviews. Neuroscience",2011,"Behaviour: 'Chillax' with probiotics.","Sian","Lewis","","","","Comment","[]","False","Sian","","female",0.99,226,NA,NA,NA
23798,"Nature reviews. Neuroscience",2011,"Ageing: ageing, it's in the blood.","Darran","Yates","","","","Comment","[]","False","Darran","","male",1,13,NA,NA,NA
23800,"Nature reviews. Neuroscience",2011,"In search of biomarkers for autism: scientific, social and ethical challenges.","Pat","Walsh","Ilina","Singh","Centre of Medical Law and Ethics, School of Law, King's College, London WC2R 2LS, UK. patricia.walsh@kcl.ac.uk","Research Support, Non-U.S. Gov't","['Mayada', 'Patrick']","True","Pat","Ilina","female",0.6,1242,"female",1,6
23801,"Nature reviews. Neuroscience",2011,"Diencephalic and brainstem mechanisms in migraine.","Simon","Akerman","Peter J","Goadsby","Headache Group, Department of Neurology, University of California, San Francisco, California 94115, USA.","Journal Article","['Philip R']","True","Simon","Peter","male",0.99,2443,"male",1,4373
1031,"Nature reviews. Neuroscience",2010,"Neural reorganization following sensory loss: the opportunity of change.","Lotfi B","Merabet","Alvaro","Pascual-Leone","Berenson-Allen Center for Noninvasive Brain Stimulation, Department of Neurology, Beth Israel Deaconess Medical Center, Harvard Medical School, KS-158 Boston, Massachusetts 02215, USA. lmerabet@bidmc.harvard.edu","Journal Article","[]","True","Lotfi","Alvaro","male",1,22,"male",1,671
17022,"Nature reviews. Neuroscience",2010,"Neurotalk: improving the communication of neuroscience research.","Judy","Illes","Samuel","Weiss","National Core for Neuroethics, The University of British Columbia, 2211 Wesbrook Mall, Koerner S124, Vancouver, British Columbia V6T 2B5, Canada. judy.illes@ubc.ca","Research Support, N.I.H., Extramural","['Mary Anne', 'Jennifer B', 'Eric', 'Sandra', 'Arthur', 'Erika Check', 'Jay', 'Tiffany', 'Peter', 'Christie', 'Anthony', 'Kevin D', 'Elaine']","True","Judy","Samuel","female",1,1375,"male",1,1409
17024,"Nature reviews. Neuroscience",2010,"Mechanisms underlying spontaneous patterned activity in developing neural circuits.","Aaron G","Blankenship","Marla B","Feller","Neurosciences Graduate Program, University of California, San Diego, La Jolla, California 92093, USA.","Journal Article","[]","True","Aaron","Marla","male",1,2280,"female",1,142
17030,"Nature reviews. Neuroscience",2010,"Advances in visual perceptual learning and plasticity.","Yuka","Sasaki","Takeo","Watanabe","Martinos Center for Biomedical Imaging, Massachusetts General Hospital, Charlestown, Massachusetts 02129, USA.","Journal Article","['Jose E']","True","Yuka","Takeo","female",0.98,43,"male",1,3
10708,"Nature reviews. Neuroscience",2016,"Region-specific roles of the corticotropin-releasing factor-urocortin system in stress.","Marloes J A G","Henckens","Alon","Chen","Department of Neurobiology, Weizmann Institute of Science, Rehovot 7610001, Israel.","Journal Article","['Jan M']","True","Marloes","Alon","female",1,42,"male",0.98,50
3307,"Nature reviews. Neuroscience",2013,"Sensory processing: a gate for sensory responses.","Leonie","Welberg","","","","Comment","[]","False","Leonie","","female",1,118,NA,NA,NA
3308,"Nature reviews. Neuroscience",2013,"Neural circuits: stop 'n' go.","Monica Hoyos","Flight","","","","Comment","[]","False","Monica","","female",1,2787,NA,NA,NA
3309,"Nature reviews. Neuroscience",2013,"Spatial processing: connecting up the grid.","Darran","Yates","","","","Comment","[]","False","Darran","","male",1,13,NA,NA,NA
3310,"Nature reviews. Neuroscience",2013,"The inner sense of time: how the brain creates a representation of duration.","Marc","Wittmann","","","Institute for Frontier Areas of Psychology and Mental Health, Department of Empirical and Analytical Psychophysics, Wilhelmstr. 3a, 79098 Freiburg, Germany. wittmann@igpp.de","Research Support, Non-U.S. Gov't","[]","True","Marc","","male",1,1555,NA,NA,NA
21699,"Nature reviews. Neuroscience",2013,"Cell biology of the neuron: fuelling transport.","Darran","Yates","","","","Comment","[]","False","Darran","","male",1,13,NA,NA,NA
21702,"Nature reviews. Neuroscience",2013,"Learning and memory: austerity measures for memory.","Sian","Lewis","","","","Comment","[]","False","Sian","","female",0.99,226,NA,NA,NA
21703,"Nature reviews. Neuroscience",2013,"Long-distance retrograde neurotrophic factor signalling in neurons.","Anthony W","Harrington","David D","Ginty","The Solomon H. Snyder Department of Neuroscience and Howard Hughes Medical Institute, The Johns Hopkins University School of Medicine, Baltimore, Maryland                 21205, USA.","Journal Article","[]","True","Anthony","David","male",1,3029,"male",1,12593
21705,"Nature reviews. Neuroscience",2013,"Attentional enhancement of spatial resolution: linking behavioural and neurophysiological evidence.","Katharina","Anton-Erxleben","Marisa","Carrasco","Psychology & Neural Science, Meyer Building, 6 Washington Place, Room 970, New York University, New York, New York 10003, USA. kae258@nyu.edu","Journal Article","[]","True","Katharina","Marisa","female",1,244,"female",1,612
11179,"Nature reviews. Neuroscience",2013,"Neuroscience thinks big (and collaboratively).","Eric R","Kandel","Christof","Koch","Columbia University, Department of Neuroscience, 1051 Riverside Drive, NYSPI-UNIT 25, New York, New York 10032, USA. erk5@columbia.edu","Review","['Henry', 'Paul M', 'Rafael']","True","Eric","Christof","male",1,4110,"male",1,33
17741,"Nature reviews. Neuroscience",2013,"Spatial processing: Humans are on the grid.","Katherine","Whalley","","","","Comment","[]","False","Katherine","","female",1,1413,NA,NA,NA
813,"Nature reviews. Neuroscience",2014,"A neurocentric perspective on glioma invasion.","Vishnu Anand","Cuddapah","Harald","Sontheimer","Department of Neurobiology, Center for Glial Biology in Medicine, University of Alabama at Birmingham, 1719 6th Avenue South, CIRC 425, Birmingham, Alabama 35294, USA.","Journal Article","['Stefanie', 'Stacey']","True","Vishnu","Harald","male",0.99,85,"male",1,80
814,"Nature reviews. Neuroscience",2014,"Is the din really harmless? Long-term effects of non-traumatic noise on the adult auditory system.","Boris","Gourévitch","Jos J","Eggermont","Centre de Neurosciences Paris-Sud (CNPS), CNRS UMR 8195, Paris, France; and the Université Paris-Sud, Bâtiment 446, 91405 Orsay Cedex, France.","Journal Article","['Jean-Marc', 'Florian']","True","Boris","Jos","male",1,288,"male",0.85,72
15646,"Nature reviews. Neuroscience",2014,"The functional architecture of the ventral temporal cortex and its role in categorization.","Kalanit","Grill-Spector","Kevin S","Weiner","1] Department of Psychology, Stanford University, Stanford, California 94305, USA. [2] Stanford Neuroscience Institute, Stanford University, Stanford, California 94305, USA.","Journal Article","[]","True","Kalanit","Kevin",NA,NA,NA,"male",1,5362
24989,"Nature reviews. Neuroscience",2015,"Contrast coding in the electrosensory system: parallels with visual computation.","Stephen E","Clarke","Leonard","Maler","Department of Cellular and Molecular Medicine, University of Ottawa, 451 Smyth Road, Ottawa, Ontario K1H 8M5, Canada.","Journal Article","['André']","True","Stephen","Leonard","male",1,2608,"male",1,201
26291,"Nature reviews. Neuroscience",2017,"Learning and memory: When novel becomes familiar.","Sian","Lewis","","","","Journal Article","[]","False","Sian","","female",0.99,226,NA,NA,NA
26295,"Nature reviews. Neuroscience",2017,"Functional consequences of neuropeptide and small-molecule co-transmission.","Michael P","Nusbaum","Eve","Marder","Department of Neuroscience, Perelman School of Medicine, University of Pennsylvania, Philadelphia, Pennsylvania 19104, USA.","Journal Article","['Dawn M']","True","Michael","Eve","male",1,11094,"female",0.99,324
26296,"Nature reviews. Neuroscience",2017,"Non-motor features of Parkinson disease.","Anthony H V","Schapira","Peter","Jenner","Department of Clinical Neurosciences, University College London (UCL) Institute of Neurology, Royal Free Campus, Rowland Hill Street, London NW3 2PF, UK.","Journal Article","['K Ray']","True","Anthony","Peter","male",1,3029,"male",1,4373
16942,"Nature reviews. Neuroscience",2012,"Behavioural neuroscience: taking axonal delivery of oxytocin.","Darran","Yates","","","","Comment","[]","False","Darran","","male",1,13,NA,NA,NA
16943,"Nature reviews. Neuroscience",2012,"Cellular neuroanatomy: primary cilia, the key to integration.","Monica Hoyos","Flight","","","","Comment","[]","False","Monica","","female",1,2787,NA,NA,NA
10237,"Nature reviews. Neuroscience",2007,"The neuronal background K2P channels: focus on TREK1.","Eric","Honoré","","","Institut de Pharmacologie Moléculaire et Cellulaire, CNRS UMR 6097, Université de Nice-Sophia Antipolis, 660 route des Lucioles, 06560 Valbonne, France. honore@ipmc.cnrs.fr","Journal Article","[]","True","Eric","","male",1,4110,NA,NA,NA
10238,"Nature reviews. Neuroscience",2007,"The machinery of colour vision.","Samuel G","Solomon","Peter","Lennie","Disciplines of Physiology, Anatomy and Histology, School of Medical Sciences and Bosch Institute, Anderson-Stuart Building F13, The University of Sydney, New South Wales 2006, Australia.","Journal Article","[]","True","Samuel","Peter","male",1,1409,"male",1,4373
10239,"Nature reviews. Neuroscience",2007,"Agenesis of the corpus callosum: genetic, developmental and functional aspects of connectivity.","Lynn K","Paul","Elliott H","Sherr","California Institute of Technology, MC 228-77 Pasadena, California 91125, USA. lkpaul@hss.caltech.edu","Journal Article","['Warren S', 'Ralph', 'J Michael', 'Linda J', 'Pratik']","True","Lynn","Elliott","female",0.96,1144,"male",0.99,179
10240,"Nature reviews. Neuroscience",2007,"The neurobiology of punishment.","Ben","Seymour","Ray","Dolan","The Wellcome Trust Centre for Neuroimaging, Institute of Neurology, UCL, 12 Queen Square, London WC1X 3BG, UK. bjseymour@gmail.com","Journal Article","['Tania']","True","Ben","Ray","male",0.99,3363,"male",0.98,975
20347,"Nature reviews. Neuroscience",2006,"Macular degeneration: recent advances and therapeutic opportunities.","Amir","Rattner","Jeremy","Nathans","Department of Molecular Biology and Genetics, Howard Hughes Medical Institute, Johns Hopkins University School of Medicine, Baltimore, Maryland 21205, USA.","Journal Article","[]","True","Amir","Jeremy","male",1,508,"male",0.99,1840
20348,"Nature reviews. Neuroscience",2006,"Patterns of neural stem and progenitor cell division may underlie evolutionary cortical expansion.","Arnold","Kriegstein","Verónica","Martínez-Cerdeño","Institute for Stem Cell and Tissue Biology, University of California, San Francisco, 513 Parnassus Ave, HSW, 1201, San Francisco, California, USA. kriegsteina@stemcell.ucsf.edu","Journal Article","['Stephen']","True","Arnold","Verónica","male",0.98,186,"female",1,888
3091,"Nature reviews. Neuroscience",2010,"Active perception: sensorimotor circuits as a cortical basis for language.","Friedemann","Pulvermüller","Luciano","Fadiga","Medical Research Council, Cognition and Brain Sciences Unit, 15 Chaucer Road, Cambridge, CB2 2EF, UK. friedemann.pulvermuller@mrc-cbu.cam.ac.uk","Journal Article","[]","True","Friedemann","Luciano","male",1,2,"male",1,365
3093,"Nature reviews. Neuroscience",2010,"100 years of Drosophila research and its impact on vertebrate neuroscience: a history lesson for the future.","Hugo J","Bellen","Hiroshi","Tsuda","Department ofNeuroscience, Baylor College of Medicine, Houston, TX 77030, USA. hbellen@bcm.tmc.edu","Journal Article","['Chao']","True","Hugo","Hiroshi","male",1,836,"male",1,19
8807,"Nature reviews. Neuroscience",2010,"Emerging roles for G protein-gated inwardly rectifying potassium (GIRK) channels in health and disease.","Christian","Lüscher","Paul A","Slesinger","Department of Basic Neurosciences, Medical Faculty, University of Geneva, 1 Michel Servet, CH-1211 Geneva, Switzerland. christian.luscher@unige.ch","Journal Article","[]","True","Christian","Paul","male",0.99,2548,"male",1,5931
23374,"Nature reviews. Neuroscience",2010,"Beyond IQ comparisons: intra-individual training differences.","Olivier","Houdé","","","","Comment","[]","False","Olivier","","male",0.99,715,NA,NA,NA
23375,"Nature reviews. Neuroscience",2010,"Branching out: mechanisms of dendritic arborization.","Yuh-Nung","Jan","Lily Yeh","Jan","Howard Hughes Medical Institute, Department of Physiology, University of California, 1550 4th Street, San Francisco 94158, USA. YuhNung.Jan@ucsf.edu","Journal Article","[]","True","Yuh-Nung","Lily",NA,NA,NA,"female",0.99,553
6777,"Nature reviews. Neuroscience",2011,"Oscillations: networking improves performance.","Leonie","Welberg","","","","Comment","[]","False","Leonie","","female",1,118,NA,NA,NA
6778,"Nature reviews. Neuroscience",2011,"Memory: A growing role for IGF2.","Leonie","Welberg","","","","Comment","[]","False","Leonie","","female",1,118,NA,NA,NA
20768,"Nature reviews. Neuroscience",2011,"Microglia: non-apoptotic caspases are no less deadly.","Monica Hoyos","Flight","","","","Comment","[]","False","Monica","","female",1,2787,NA,NA,NA
20770,"Nature reviews. Neuroscience",2011,"Linking lipids to Alzheimer's disease: cholesterol and beyond.","Gilbert","Di Paolo","Tae-Wan","Kim","Department of Pathology and Cell Biology, Taub Institute for Research on Alzheimer's Disease and the Aging Brain, Columbia University Medical Center, 630 West 168th Street, New York, New York 10032, USA. gil.dipaolo@columbia.edu","Journal Article","[]","True","Gilbert","Tae-Wan","male",1,194,NA,NA,NA
24074,"Nature reviews. Neuroscience",2016,"Techniques: Magnetic manipulation.","Sian","Lewis","","","","Comment","[]","False","Sian","","female",0.99,226,NA,NA,NA
24076,"Nature reviews. Neuroscience",2016,"The ontogeny of the cortical language network.","Michael A","Skeide","Angela D","Friederici","Department of Neuropsychology, Max Planck Institute for Human Cognitive and Brain Sciences, Stephanstrasse 1a, 04103 Leipzig, Germany.","Research Support, Non-U.S. Gov't","[]","True","Michael","Angela","male",1,11094,"female",1,3511
1163,"Nature reviews. Neuroscience",2014,"Learning and memory: unlearning fear.","Darran","Yates","","","","Comment","[]","False","Darran","","male",1,13,NA,NA,NA
1164,"Nature reviews. Neuroscience",2014,"Sleep: a rude awakening.","Sian","Lewis","","","","Comment","[]","False","Sian","","female",0.99,226,NA,NA,NA
1165,"Nature reviews. Neuroscience",2014,"Sensory systems: protons: thinking laterally.","Katherine","Whalley","","","","Comment","[]","False","Katherine","","female",1,1413,NA,NA,NA
1166,"Nature reviews. Neuroscience",2014,"Synaptic tagging during memory allocation.","Thomas","Rogerson","Alcino J","Silva","Departments of Neurobiology, Psychiatry & Biobehavioral Sciences, and Psychology, Integrative Center for Learning and Memory, Brain Research Institute, University of California, Los Angeles, California 90095-1761, USA.","Journal Article","['Denise J', 'Adam', 'Yoshitake', 'Justin', 'Manuel F']","True","Thomas","Alcino","male",1,3753,"male",1,1
21990,"Nature reviews. Neuroscience",2014,"On the other hand: including left-handers in cognitive neuroscience and neurogenetics.","Roel M","Willems","Clyde","Francks","Donders Institute for Brain, Cognition and Behaviour, Radboud University Nijmegen, 6525 EN Nijmegen, The Netherlands.Max Planck Institute for Psycholinguistics, 6525 XD Nijmegen, The Netherlands.","Research Support, Non-U.S. Gov't","['Lise', 'Simon E']","True","Roel","Clyde","male",1,53,"male",0.97,36
21991,"Nature reviews. Neuroscience",2014,"Neuroendocrinology: programming the projections.","Darran","Yates","","","","Comment","[]","False","Darran","","male",1,13,NA,NA,NA
21992,"Nature reviews. Neuroscience",2014,"Fear: balancing memories.","Leonie","Welberg","","","","Comment","[]","False","Leonie","","female",1,118,NA,NA,NA
21993,"Nature reviews. Neuroscience",2014,"Synaptic plasticity: unmasked: dendritic mRNA dynamics.","Katherine","Whalley","","","","Comment","[]","False","Katherine","","female",1,1413,NA,NA,NA
16013,"Nature reviews. Neuroscience",2015,"Neuroimmunology: Adding insult to allergy.","Fiona","Carr","","","","Comment","[]","False","Fiona","","female",1,926,NA,NA,NA
16020,"Nature reviews. Neuroscience",2015,"Development and functions of the choroid plexus-cerebrospinal fluid system.","Melody P","Lun","Maria K","Lehtinen","1] Department of Pathology, Boston Children's Hospital, Boston, Massachusetts 02115, USA. [2] Department of Pathology and Laboratory Medicine, Boston University School of Medicine, Boston, Massachusetts 02118, USA.","Journal Article","['Edwin S']","True","Melody","Maria","female",0.99,343,"female",0.99,8402
9978,"Nature reviews. Neuroscience",2014,"Peripheral thermosensation in mammals.","Joris","Vriens","Thomas","Voets","Laboratory of Experimental Gynaecology, KU Leuven, Herestraat 49 BOX 611, B-3000 Leuven, Belgium.","Journal Article","['Bernd']","True","Joris","Thomas","male",1,52,"male",1,3753
29131,"Nature reviews. Neuroscience",2014,"Neurodegenerative disease: propagating pathology.","Katherine","Whalley","","","","Journal Article","[]","False","Katherine","","female",1,1413,NA,NA,NA
15927,"Nature reviews. Neuroscience",2017,"Neuroimmunology: Scratching the surface of chronic itch.","Katherine","Whalley","","","","Journal Article","[]","False","Katherine","","female",1,1413,NA,NA,NA
15929,"Nature reviews. Neuroscience",2017,"Synaptic plasticity: Strength through movement.","Sian","Lewis","","","","Journal Article","[]","False","Sian","","female",0.99,226,NA,NA,NA
