"X","journal","year","title","fname_first","lname_first","fname_last","lname_last","affiliation","article_type","middle_authors","abstract","fname_first_trunc","fname_last_trunc","gender_first","p_first","n_first","gender_last","p_last","n_last"
16212,"Nature reviews. Neuroscience",2007,"Development of GABA innervation in the cerebral and cerebellar cortices.","Z J","Huang","F","Ango","Cold Spring Harbour Laboratory, One Bungtown Road, Cold Spring Harbor, New York 11724, USA. huangj@cshl.edu","Journal Article","['G']","True","Z","F","male",0.6,5,"male",0.67,6
16214,"Nature reviews. Neuroscience",2007,"Long-term synaptic plasticity in hippocampal interneurons.","Dimitri M","Kullmann","Karri P","Lamsa","Institute of Neurology, University College London, Queen Square, London, WC1N 3BG, United Kingdom. d.kullmann@ion.ucl.ac.uk","Journal Article","[]","True","Dimitri","Karri","male",1,197,"female",0.87,31
16215,"Nature reviews. Neuroscience",2007,"Spontaneous fluctuations in brain activity observed with functional magnetic resonance imaging.","Michael D","Fox","Marcus E","Raichle","Mallinckrodt Institute of Radiology, Washington University School of Medicine, 4525 Scott Avenue, St. Louis, Missouri 63110, USA. foxm@npg.wustl.edu","Journal Article","[]","True","Michael","Marcus","male",1,11094,"male",1,970
16216,"Nature reviews. Neuroscience",2007,"The effect of neurodegenerative diseases on the subventricular zone.","Maurice A","Curtis","Peter S","Eriksson","Institute of Neuroscience and Physiology at Sahlgrenska Academy, Medicinaregat 11, Box 432, s-40530 Göteborg, Sweden. maurice.curtis@neuro.gu.se","Journal Article","['Richard L M']","True","Maurice","Peter","male",0.98,221,"male",1,4373
16217,"Nature reviews. Neuroscience",2007,"Can neuroscience be integrated into the DSM-V?","Steven E","Hyman","","","Harvard University, Massachusetts Hall, Cambridge, Massachusetts 02138, USA. seh@harvard.edu","Journal Article","[]","True","Steven","","male",1,2600,NA,NA,NA
12404,"Nature reviews. Neuroscience",2011,"Virtual reality in neuroscience research and therapy.","Corey J","Bohil","Frank A","Biocca","Department of Psychology, University of Central Florida, Orlando, Florida, USA.","Research Support, Non-U.S. Gov't","['Bradly']","True","Corey","Frank","male",0.91,638,"male",1,1565
12405,"Nature reviews. Neuroscience",2011,"Neurovascular pathways to neurodegeneration in Alzheimer's disease and other disorders.","Berislav V","Zlokovic","","","Department of Physiology and Biophysics, and Center for Neurodegeneration and Regeneration at the Zilkha Neurogenetic Institute, University of Southern California, Keck School of Medicine, 1501 San Pablo Street, Los Angeles, California 90089, USA. bzlokovi@usc.edu","Journal Article","[]","True","Berislav","","male",1,3,NA,NA,NA
12407,"Nature reviews. Neuroscience",2011,"Neurodegenerative disease: CRF is the culprit.","Leonie","Welberg","","","","Comment","[]","False","Leonie","","female",1,118,NA,NA,NA
5353,"Nature reviews. Neuroscience",2017,"How and why do T cells and their derived cytokines affect the injured and healthy brain?","Anthony J","Filiano","Jonathan","Kipnis","Center for Brain Immunology and Glia, Department of Neuroscience, School of Medicine, University of Virginia, Charlottesville, Virginia 22908, USA.","Journal Article","['Sachin P']","True","Anthony","Jonathan","male",1,3029,"male",1,3702
5354,"Nature reviews. Neuroscience",2017,"Neural development: Keeping a lid on alternative fates.","Katherine","Whalley","","","","Journal Article","[]","False","Katherine","","female",1,1413,NA,NA,NA
27074,"Nature reviews. Neuroscience",2017,"Adult hippocampal neurogenesis and cognitive flexibility - linking memory and mood.","Christoph","Anacker","René","Hen","Department of Psychiatry, Columbia University and Research Foundation for Mental Hygiene, New York State Psychiatric Institute, 1051 Riverside Drive, New York 10032, New York, USA.","Journal Article","[]","True","Christoph","René","male",1,192,"male",0.99,118
5270,"Nature reviews. Neuroscience",2015,"Sensory theories of developmental dyslexia: three challenges for research.","Usha","Goswami","","","Centre for Neuroscience in Education, Department of Psychology, Downing Street, Cambridge CB2 3EB, UK.","Research Support, Non-U.S. Gov't","[]","True","Usha","","female",1,64,NA,NA,NA
5271,"Nature reviews. Neuroscience",2014,"GLIA: oligodendrocytes rev up motor learning.","Natasha","Bray","","","","Comment","[]","False","Natasha","","female",1,981,NA,NA,NA
21035,"Nature reviews. Neuroscience",2014,"The warrior in the machine: neuroscience goes to war.","Irene","Tracey","Rod","Flower","Oxford Centre for Functional Magnetic Resonance Imaging of the Brain and at the Nuffield Division of Anaesthetics, Nuffield Department of Clinical Neurosciences. University of Oxford, John Radcliffe Hospital, Oxford, OX3 9DU, UK.","Review","[]","True","Irene","Rod","female",1,1300,"male",1,191
21037,"Nature reviews. Neuroscience",2014,"Polyunsaturated fatty acids and their metabolites in brain function and disease.","Richard P","Bazinet","Sophie","Layé","Department of Nutritional Sciences, University of Toronto, Toronto, Ontario M5S 3E2, Canada.","Journal Article","[]","True","Richard","Sophie","male",1,4381,"female",1,1836
16847,"Nature reviews. Neuroscience",2015,"Behavioural neuroscience: Going on the defensive.","Darran","Yates","","","","Comment","[]","False","Darran","","male",1,13,NA,NA,NA
16848,"Nature reviews. Neuroscience",2015,"Neural circuits: Unpredictable turns in the worm.","Fiona","Carr","","","","Comment","[]","False","Fiona","","female",1,926,NA,NA,NA
16849,"Nature reviews. Neuroscience",2015,"Memory: Remembering to forget.","Natasha","Bray","","","","Comment","[]","False","Natasha","","female",1,981,NA,NA,NA
16850,"Nature reviews. Neuroscience",2015,"Cortical plasticity: A critical role for Clock.","Katherine","Whalley","","","","Comment","[]","False","Katherine","","female",1,1413,NA,NA,NA
7157,"Nature reviews. Neuroscience",2014,"Oscillations: Synchrony shows mice the way.","Leonie","Welberg","","","","Comment","[]","False","Leonie","","female",1,118,NA,NA,NA
7158,"Nature reviews. Neuroscience",2014,"Neural development: Astrocyte semaphores guide circuit formation.","Natasha","Bray","","","","Comment","[]","False","Natasha","","female",1,981,NA,NA,NA
7160,"Nature reviews. Neuroscience",2014,"Neurodegenerative disease: Revealing cellular targets in HD.","Darran","Yates","","","","Comment","[]","False","Darran","","male",1,13,NA,NA,NA
22666,"Nature reviews. Neuroscience",2014,"Neurotransmitters: Midbrain neurons recycle GABA.","Natasha","Bray","","","","Comment","[]","False","Natasha","","female",1,981,NA,NA,NA
22668,"Nature reviews. Neuroscience",2014,"Brain ageing: Blood-derived rejuvenation.","Darran","Yates","","","","Comment","[]","False","Darran","","male",1,13,NA,NA,NA
22669,"Nature reviews. Neuroscience",2014,"Neural processing of natural sounds.","Frédéric E","Theunissen","Julie E","Elie","Department of Psychology and Helen Wills Neuroscience Institute, University of California, Berkeley, California 94720, USA.","Journal Article","[]","True","Frédéric","Julie","male",0.99,440,"female",1,4260
22670,"Nature reviews. Neuroscience",2014,"Neurobiology of food intake in health and disease.","Gregory J","Morton","Michael W","Schwartz","Diabetes and Obesity Center of Excellence, Department of Medicine, University of Washington, Seattle, Washington 98109, USA.","Journal Article","['Thomas H']","True","Gregory","Michael","male",1,721,"male",1,11094
22672,"Nature reviews. Neuroscience",2014,"Wallerian degeneration: an emerging axon death pathway linking injury and disease.","Laura","Conforti","Michael P","Coleman","1] School of Biomedical Sciences, University of Nottingham, Medical School, Queen's Medical Centre, Nottingham, NG7 2UH, UK. [2].","Journal Article","['Jonathan']","True","Laura","Michael","female",1,7953,"male",1,11094
22675,"Nature reviews. Neuroscience",2014,"Obsessive-compulsive disorder: an integrative genetic and neurobiological perspective.","David L","Pauls","Daniel A","Geller","1] Department of Psychiatry, Harvard Medical School, Boston, Massachusetts 02115 USA. [2] Department of Psychiatry, Massachusetts General Hospital, Boston, Massachusetts 02114, USA. [3] Psychiatric and Neurodevelopmental Genetics Unit, Center for Human Genetic Research, Massachusetts General Hospital, Boston, Massachusetts 02114, USA.","Journal Article","['Amitai', 'Scott L']","True","David","Daniel","male",1,12593,"male",1,8180
15432,"Nature reviews. Neuroscience",2011,"How does PKMζ maintain long-term memory?","Todd C","Sacktor","","","The Robert F. Furchgott Center of Neural and Behavioural Science, Department of Physiology, State University of New York Downstate Medical Center, 450 Clarkson Avenue, Brooklyn, New York 11203, USA. tsacktor@downstate.edu","Journal Article","[]","True","Todd","","male",1,847,NA,NA,NA
27475,"Nature reviews. Neuroscience",2010,"Brain-machine interfaces: See what you want to see.","Leonie","Welberg","","","","Comment","[]","False","Leonie","","female",1,118,NA,NA,NA
27476,"Nature reviews. Neuroscience",2010,"Depression: In pursuit of happiness.","Katie","Kingwell","","","","Comment","[]","False","Katie","","female",1,3741,NA,NA,NA
27477,"Nature reviews. Neuroscience",2010,"Addiction: The ups and downs of cocaine in the NAc.","Rachel","Jones","","","","Comment","[]","False","Rachel","","female",1,4021,NA,NA,NA
27478,"Nature reviews. Neuroscience",2010,"Neurodegenerative disease: Pieces of the Parkinson's puzzle.","Yukie","Ozawa","","","","Comment","[]","False","Yukie","","female",0.78,9,NA,NA,NA
27479,"Nature reviews. Neuroscience",2010,"Endocannabinoids: Dual effects at different sites.","Leonie","Welberg","","","","Comment","[]","False","Leonie","","female",1,118,NA,NA,NA
27480,"Nature reviews. Neuroscience",2010,"Circadian rhythms: In the heat of the night.","Safia Ali","Danovi","","","","Comment","[]","False","Safia","","female",1,18,NA,NA,NA
27481,"Nature reviews. Neuroscience",2010,"Blood-brain barrier: Plugging the leak.","Ezzie","Hutchinson","","","","Comment","[]","False","Ezzie","","male",1,1,NA,NA,NA
27482,"Nature reviews. Neuroscience",2010,"Neuroimmunology: Keeping HSV-1 dormant.","Rachel","David","","","","Comment","[]","False","Rachel","","female",1,4021,NA,NA,NA
27483,"Nature reviews. Neuroscience",2010,"Neuroimmunology: The origins of microglial cells.","Olive","Leavy","","","","Comment","[]","False","Olive","","female",0.95,65,NA,NA,NA
11553,"Nature reviews. Neuroscience",2015,"Neuronal circuits: Looking after your own.","Sian","Lewis","","","","Comment","[]","False","Sian","","female",0.99,226,NA,NA,NA
11555,"Nature reviews. Neuroscience",2015,"Proliferation control in neural stem and progenitor cells.","Catarina C F","Homem","Jürgen A","Knoblich","Institute of Molecular Biotechnology, Dr. Bohr Gasse 3, 1030, Vienna, Austria.","Journal Article","['Marko']","True","Catarina","Jürgen","female",0.99,85,"male",1,48
7708,"Nature reviews. Neuroscience",2014,"Neurogenic neuroinflammation: inflammatory CNS reactions in response to neuronal activity.","Dimitris N","Xanthos","Jürgen","Sandkühler","Department of Neurophysiology, Center for Brain Research, Medical University of Vienna, Spitalgasse 4, A-1090 Vienna, Austria.","Journal Article","[]","True","Dimitris","Jürgen","male",1,287,"male",1,48
26679,"Nature reviews. Neuroscience",2014,"Diversity and complexity in the pyramidal tract projectome.","Gordon M G","Shepherd","","","Department of Physiology, Feinberg School of Medicine, Northwestern University, Chicago, Illinois 60611, USA.","Comment","[]","False","Gordon","","male",1,416,NA,NA,NA
26680,"Nature reviews. Neuroscience",2014,"Corticostriatal and mesocortical dopamine systems: do species differences matter?","Yoland","Smith","Mahlon R","DeLong","Yerkes National Primate Research Center, the Morris UDALL Center of Excellence for Parkinson's Disease and the Department of Neurology, Emory University, 954 Gatewood Rd NE, Atlanta, Georgia 30322, USA.","Comment","['Thomas']","False","Yoland","Mahlon","female",0.5,2,"female",0.5,2
26681,"Nature reviews. Neuroscience",2014,"Behavioural neuroscience: the feminine touch dampens aggression.","Monica Hoyos","Flight","","","","Comment","[]","False","Monica","","female",1,2787,NA,NA,NA
26682,"Nature reviews. Neuroscience",2014,"Neural repair: export duties for HDAC5.","Katherine","Whalley","","","","Comment","[]","False","Katherine","","female",1,1413,NA,NA,NA
26683,"Nature reviews. Neuroscience",2014,"Sensory systems: connecting olfaction.","Darran","Yates","","","","Comment","[]","False","Darran","","male",1,13,NA,NA,NA
1355,"Nature reviews. Neuroscience",2012,"The honeybee as a model for understanding the basis of cognition.","Randolf","Menzel","","","Institute of Biology - Neurobiology, Free University of Berlin, 28/30 Königin-Luise-Strass, D-14195 Berlin, Germany. menzel@neurobiologie.fu.berlin.de","Journal Article","[]","True","Randolf","","male",1,3,NA,NA,NA
1356,"Nature reviews. Neuroscience",2012,"The BCM theory of synapse modification at 30: interaction of theory with experiment.","Leon N","Cooper","Mark F","Bear","Institute for Brain and Neural Systems, Department of Physics, Brown University, Providence, Rhode Island 02912, USA. leon_cooper@brown.edu","Journal Article","[]","True","Leon","Mark","male",0.99,409,"male",1,6176
14896,"Nature reviews. Neuroscience",2012,"Neurotransmission: Anxious interactions.","Leonie","Welberg","","","","Comment","[]","False","Leonie","","female",1,118,NA,NA,NA
14898,"Nature reviews. Neuroscience",2012,"Neurotransmission: GABA calls stop in the striatum.","Rachel","Jones","","","","Comment","[]","False","Rachel","","female",1,4021,NA,NA,NA
18820,"Nature reviews. Neuroscience",2010,"Long-term depression in the CNS.","Graham L","Collingridge","Yu Tian","Wang","Department of Anatomy, School of Medical Sciences, University Walk, Bristol, BS8 1TD, UK. G.L.Collingridge@bristol.ac.uk","Journal Article","['Stephane', 'John G']","True","Graham","Tian","male",1,603,"male",0.67,24
18822,"Nature reviews. Neuroscience",2010,"The habenula: from stress evasion to value-based decision-making.","Okihide","Hikosaka","","","National Eye Institute, National Institutes of Health, Bethesda, MD 20892-4435, USA. oh@lsr.nei.nih.gov","Journal Article","[]","True","Okihide","",NA,NA,NA,NA,NA,NA
18826,"Nature reviews. Neuroscience",2010,"Behavioural phenotyping assays for mouse models of autism.","Jill L","Silverman","Jacqueline N","Crawley","National Institute of Mental Health, Porter Neuroscience Research Center, Bethesda, MD 20892-3730, USA.","Journal Article","['Mu', 'Catherine']","True","Jill","Jacqueline","female",1,1335,"female",1,1016
18464,"Nature reviews. Neuroscience",2007,"NMDA receptor trafficking in synaptic plasticity and neuropsychiatric disorders.","C Geoffrey","Lau","R Suzanne","Zukin","Rose F. Kennedy Center for Research in Mental Retardation and Developmental Disabilities, Albert Einstein College of Medicine, Bronx, New York 10461, USA.","Journal Article","[]","True","Geoffrey","Suzanne","male",1,262,"female",1,1024
18465,"Nature reviews. Neuroscience",2007,"Neuronal subtype specification in the cerebral cortex.","Bradley J","Molyneaux","Jeffrey D","Macklis","MGH-HMS Center for Nervous System Repair, Department of Neurosurgery, Program in Neuroscience, Harvard Medical School, Massachusetts General Hospital, Boston, Massachusetts 02114, USA.","Journal Article","['Paola', 'Joao R L']","True","Bradley","Jeffrey","male",1,394,"male",1,932
18466,"Nature reviews. Neuroscience",2007,"Cell-cycle control and cortical development.","Colette","Dehay","Henry","Kennedy","INSERM, U846, 18 Avenue Doyen Lépine, 69675 Bron Cedex, France. dehay@lyon.inserm.fr","Journal Article","[]","True","Colette","Henry","female",1,209,"male",1,1067
18467,"Nature reviews. Neuroscience",2007,"The action potential in mammalian central neurons.","Bruce P","Bean","","","Harvard Medical School, Department of Neurobiology, 220 Longwood Avenue, Boston, Massachusetts 02115, USA. bruce_bean@hms.harvard.edu","Journal Article","[]","True","Bruce","","male",1,800,NA,NA,NA
18468,"Nature reviews. Neuroscience",2007,"Enteric nervous system development and Hirschsprung's disease: advances in genetic and stem cell studies.","Tiffany A","Heanue","Vassilis","Pachnis","Division of Molecular Neurobiology, MRC National Institute for Medical Research, The Ridgeway, Mill Hill, London NW7 1AA, UK.","Journal Article","[]","True","Tiffany","Vassilis","female",1,1466,"male",1,20
18469,"Nature reviews. Neuroscience",2007,"How widespread is adult neurogenesis in mammals?","Elizabeth","Gould","","","Department of Psychology, Princeton University, Princeton, New Jersey 08544, USA. goulde@princeton.edu","Journal Article","[]","True","Elizabeth","","female",1,3508,NA,NA,NA
4743,"Nature reviews. Neuroscience",2012,"Neuroimmunology: Interferon-γ tunes the rhythm.","Leonie","Welberg","","","","Comment","[]","False","Leonie","","female",1,118,NA,NA,NA
4748,"Nature reviews. Neuroscience",2012,"Spectral fingerprints of large-scale neuronal interactions.","Markus","Siegel","Andreas K","Engel","Centre for Integrative Neuroscience, University of Tübingen, 72076 Tübingen, Germany. markus.siegel@uni-tuebingen.de","Journal Article","['Tobias H']","True","Markus","Andreas","male",1,412,"male",1,1021
21678,"Nature reviews. Neuroscience",2012,"Neural development: Clustering connections.","Darran","Yates","","","","Comment","[]","False","Darran","","male",1,13,NA,NA,NA
21679,"Nature reviews. Neuroscience",2012,"Psychiatric disorders: Why two is better than one.","Leonie","Welberg","","","","Comment","[]","False","Leonie","","female",1,118,NA,NA,NA
21680,"Nature reviews. Neuroscience",2012,"Recruiting adaptive cellular stress responses for successful brain ageing.","Alexis M","Stranahan","Mark P","Mattson","Physiology Department, Georgia Health Sciences University, Augusta, Georgia                 30912, USA.","Journal Article","[]","True","Alexis","Mark","male",0.52,1224,"male",1,6176
21681,"Nature reviews. Neuroscience",2012,"Neurodegenerative disease: Preventing 'SIRTain' death by mutant huntingtin.","Monica Hoyos","Flight","","","","Comment","[]","False","Monica","","female",1,2787,NA,NA,NA
21682,"Nature reviews. Neuroscience",2012,"Activity-dependent neurotransmitter respecification.","Nicholas C","Spitzer","","","Neurobiology Section, Division of Biological Sciences, Kavli Institute for Brain and Mind, University of California at San Diego, La Jolla, California 92093, USA. nspitzer@ucsd.edu","Journal Article","[]","True","Nicholas","","male",1,1176,NA,NA,NA
21689,"Nature reviews. Neuroscience",2012,"Interneuron dysfunction in psychiatric disorders.","Oscar","Marín","","","Instituto de Neurociencias, Consejo Superior de Investigaciones Científicas y Universidad Miguel Hernández, 03550 Sant Joan d'Alacant, Spain. o.marin@umh.es","Journal Article","[]","True","Oscar","","male",0.99,1650,NA,NA,NA
3991,"Nature reviews. Neuroscience",2012,"Dense scents of nature.","Leonie","Welberg","","","","Comment","[]","False","Leonie","","female",1,118,NA,NA,NA
20032,"Nature reviews. Neuroscience",2012,"The stress of misfolding.","Darran","Yates","","","","Comment","[]","False","Darran","","male",1,13,NA,NA,NA
20033,"Nature reviews. Neuroscience",2012,"Spurned flies hit the booze.","Sian","Lewis","","","","Comment","[]","False","Sian","","female",0.99,226,NA,NA,NA
20034,"Nature reviews. Neuroscience",2012,"Controlling consumption.","Katherine","Whalley","","","","Comment","[]","False","Katherine","","female",1,1413,NA,NA,NA
1207,"Nature reviews. Neuroscience",2008,"A framework for studying the neurobiology of value-based decision making.","Antonio","Rangel","P Read","Montague","Division of the Humanities and Social Sciences (HSS) and Computational and Neural Systems Program, California Institute of Technology, Pasadena, California 91125, USA. rangel@hss.caltech.edu","Journal Article","['Colin']","True","Antonio","Read","male",1,2290,"male",0.75,4
22573,"Nature reviews. Neuroscience",2008,"Animal models of Alzheimer's disease and frontotemporal dementia.","Jürgen","Götz","Lars M","Ittner","Alzheimer's & Parkinson's Disease Laboratory, Brain & Mind Research Institute, University of Sydney, 100 Mallett Street, Camperdown, NSW 2050, Australia. jgoetz@med.usyd.edu.au","Journal Article","[]","True","Jürgen","Lars","male",1,48,"male",1,450
22574,"Nature reviews. Neuroscience",2008,"Mitochondrial fragmentation in neurodegeneration.","Andrew B","Knott","Ella","Bossy-Wetzel","Burnett School of Biomedical Sciences, College of Medicine, University of Central Florida, 4000 Central Florida Boulevard, Orlando, Florida 32816, USA.","Journal Article","['Guy', 'Robert']","True","Andrew","Ella","male",1,5168,"female",0.99,303
22576,"Nature reviews. Neuroscience",2008,"Petilla terminology: nomenclature of features of GABAergic interneurons of the cerebral cortex.","","","Rafael","Yuste","Molecular Neuroscience Department and Center for Neural Informatics, Structures, and Plasticity, Krasnow Institute for Advanced Study, George Mason University, MS2A1, 4400 University Drive, Fairfax, Virginia 22030, USA. ascoli@gmu.edu;","Journal Article","['Giorgio A', 'Lidia', 'Stewart A', 'German', 'Ruth', 'Andreas', 'György', 'Bruno', 'Javier', 'Alfonso', 'Dirk', 'Gord', 'Yves', 'Tamas F', 'Daniel', 'Esther P', 'Jesse H', 'Moritz', 'Shaul', 'Fuyuki', 'Zoltán F', 'Bertrand', 'David A', 'Oscar', 'Henry', 'Alberto', 'Adam', 'Carl C H', 'Kathleen S', 'Jean', 'Bernardo', 'Peter', 'Jochen F', 'Gabor', 'Alex M', 'Maria', 'Yun', 'David C']","True","","Rafael",NA,NA,NA,"male",1,1245
22578,"Nature reviews. Neuroscience",2008,"Brain foods: the effects of nutrients on brain function.","Fernando","Gómez-Pinilla","","","Department of Neurosurgery, University of California at Los Angeles School of Medicine, Los Angeles 90095, California, USA. fgomezpi@mednet.ucla.edu","Journal Article","[]","True","Fernando","","male",1,2012,NA,NA,NA
15884,"Nature reviews. Neuroscience",2009,"Neuroproteomics: understanding the molecular organization and complexity of the brain.","Alex","Bayés","Seth G N","Grant","Wellcome Trust Sanger Institute, Genome Campus, Hinxton, Cambridgeshire, CB10 1SA, UK.","Journal Article","[]","True","Alex","Seth","male",0.87,5856,"male",1,373
15885,"Nature reviews. Neuroscience",2009,"WNTs tune up the neuromuscular junction.","Ceren","Korkut","Vivian","Budnik","Department of Neurobiology, Aaron Lazare Biomedical Research Building, University of Massachusetts Medical School, Worcester, Massachusetts 01605, USA.","Journal Article","[]","True","Ceren","Vivian","female",0.99,111,"female",0.96,555
15886,"Nature reviews. Neuroscience",2009,"Experience-dependent structural synaptic plasticity in the mammalian brain.","Anthony","Holtmaat","Karel","Svoboda","Department of Basic Neurosciences, Medical Faculty, University of Geneva, Switzerland. anthony.holtmaat@unige.ch","Journal Article","[]","True","Anthony","Karel","male",1,3029,"male",0.92,90
15887,"Nature reviews. Neuroscience",2009,"Cerebellar cortical organization: a one-map hypothesis.","Richard","Apps","Richard","Hawkes","Department of Physiology and Pharmacology, School of Medical Sciences, University of Bristol, Bristol BS8 1TD, UK. r.apps@bristol.ac.uk","Journal Article","[]","True","Richard","Richard","male",1,4381,"male",1,4381
12713,"Nature reviews. Neuroscience",2008,"Actin in action: the interplay between the actin cytoskeleton and synaptic efficacy.","Lorenzo A","Cingolani","Yukiko","Goda","MRC Laboratory for Molecular Cell Biology and MRC Cell Biology Unit, University College London, Gower Street, London, WC1E 6BT, UK.","Journal Article","[]","True","Lorenzo","Yukiko","male",1,496,"female",1,32
12714,"Nature reviews. Neuroscience",2008,"Plasticity of intrinsic neuronal properties in CNS disorders.","Heinz","Beck","Yoel","Yaari","Department of Epileptology, University of Bonn Medical Center, Sigmund-Freud-Str. 25, 53105 Bonn, Germany. heinz.beck@ukb.uni-bonn.de","Journal Article","[]","True","Heinz","Yoel","male",1,41,"male",0.97,30
12715,"Nature reviews. Neuroscience",2008,"Choices in neuroscience careers.","Tamas","Bartfai","Nancy","Rothwell","","Review","['Tom', 'Gord']","True","Tamas","Nancy","male",1,6,"female",1,2716
12716,"Nature reviews. Neuroscience",2008,"General anaesthesia: from molecular targets to neuronal pathways of sleep and arousal.","Nicholas P","Franks","","","Blackett Laboratory Biophysics Section, Imperial College, South Kensington, London, SW7 2AZ, UK. n.franks@imperial.ac.uk","Journal Article","[]","True","Nicholas","","male",1,1176,NA,NA,NA
6511,"Nature reviews. Neuroscience",2017,"Reward: Restraint from risky reward.","Natasha","Bray","","","","Journal Article","[]","False","Natasha","","female",1,981,NA,NA,NA
6514,"Nature reviews. Neuroscience",2017,"Reward: Eating goes down a treat.","Natasha","Bray","","","","Journal Article","[]","False","Natasha","","female",1,981,NA,NA,NA
6515,"Nature reviews. Neuroscience",2017,"Decision making: Making hasty decisions.","Katherine","Whalley","","","","Journal Article","[]","False","Katherine","","female",1,1413,NA,NA,NA
6517,"Nature reviews. Neuroscience",2017,"The use of brain organoids to investigate neural development and disease.","Elizabeth","Di Lullo","Arnold R","Kriegstein","Eli and Edythe Broad Center of Regeneration Medicine and Stem Cell Research, University of California, San Francisco, California 94143, USA.","Journal Article","[]","True","Elizabeth","Arnold","female",1,3508,"male",0.98,186
7390,"Nature reviews. Neuroscience",2016,"Reward: A separate sweet circuit.","Fiona","Carr","","","","Comment","[]","False","Fiona","","female",1,926,NA,NA,NA
